{
  "$schema": "https://json-schema.org/draft/2020-12/schema",
  "$id": "https://github.com/happypathnetworking/fylgja/contracts/bundle-manifest/v5",
  "title": "Fylgja bundle manifest v5 — the scope and the mapping in the provenance, every interface a port, the reader’s fidelity list",
  "description": "From M6’s v2: bundle_version was 3 at M7 (D-025 and its M6 notes) and is 4 at M12 (below). `fidelity.production_forwarding` is an object, one entry per platform in the bundle keyed by its package id, so a mixed bundle asserts each platform’s forwarding and M1’s fidelity.forwarding.mixed refusal retires; `mapping[].node_name` is on every row (null on a row without a port) and `fidelity.lossy` is always present ([] when empty), ending M6’s one exception to the empty-list rule; every node gains `bootstrap` {file, via}: the bootstrap file the bundle carries for it and whether containerlab applies it at deploy (startup_config, the topology names it) or the push sends its lines before the artifact’s (push, the topology node has no startup-config; M7). A v2 or v1 bundle is refused by `twin provision` as bundle.version.unsupported naming both versions. Everything else is v2’s. From M5’s v2, bundle_version still 2 at M6: a mapping row may carry `node_name`, the node’s own name for its port, present only where it differs from `interface`; `fidelity.lossy` records every lossy mapping and every shared port, present only when it has content; omissions gain the rule omit.interface.shared. Both fields are the one deliberate exception to M1’s rule that every empty list is emitted as []: a bundle with nothing lossy in it is byte-identical to M5’s, so the goldens and both fixture ids stand and no following twin is rebuilt by the upgrade. The exception expires with M7’s bundle_version bump for per-platform forwarding (D-025), which makes both fields unconditional in the same move. From v1: bundle_version is 2, and every node gains `artifact`, the configuration file the bundle carries for it beside its bootstrap (M5). A v1 bundle is refused by `twin provision` as bundle.version.unsupported naming both versions. Nothing of Infrahub’s — artifact, storage or definition identifiers, a time of generation — appears, so bundle_id moves for the artifact’s bytes or name and for nothing else. Everything else is v1’s. M12: bundle_version is 4. Every mapping row carries enabled, the interface's intent admin state (the CTM's enabled, true when unset), so the bundle says what intent says of each port: twin verify asserts nothing of a cabled port whose row says false, and records the skip. The topology, the bootstrap and every configs file are unchanged by the field. 017 (D-057): bundle_version is 5. The provenance names the scope the read was made under and the mapping that produced the CTM ({reader, model, version}), copied from the CTM envelope, in place of the generics contract’s version; a mapping row loses `iftype`, since every interface of a CTM 2 is a port (configured-not-cabled is an uncabled port); and `fidelity.read` is the CTM envelope’s fidelity list, the reader’s own rows of what it approximated and omitted, copied unchanged by the compiler, which holds no table of any source’s rows. A v4 bundle is refused by `twin provision` as bundle.version.unsupported naming both versions. Everything else is v4’s.",
  "type": "object",
  "required": [
    "bundle_version",
    "provenance",
    "nodes",
    "mapping",
    "links",
    "omissions",
    "fidelity"
  ],
  "additionalProperties": false,
  "properties": {
    "bundle_version": {
      "const": "5"
    },
    "provenance": {
      "type": "object",
      "description": "The provenance block: the intent's address, copied from the CTM envelope minus `observed_at` and `fidelity` (which is fidelity.read). Nothing about the read, the host, the clock or the build. 017: `scope` and `mapping` in place of `contract_version`.",
      "required": [
        "branch",
        "schema_hash",
        "scope",
        "mapping"
      ],
      "additionalProperties": false,
      "properties": {
        "branch": {
          "type": "string",
          "minLength": 1
        },
        "at": {
          "type": "string",
          "description": "Present iff the operator supplied --at; verbatim."
        },
        "schema_hash": {
          "type": "string"
        },
        "scope": {
          "type": "string",
          "pattern": "^tag:\\S+$",
          "description": "017: the scope the read was made under, tag:<name>, as the CTM envelope records it."
        },
        "mapping": {
          "type": "object",
          "description": "017: which reader produced the CTM and which version of which model it read, as the CTM envelope records it.",
          "required": [
            "reader",
            "model",
            "version"
          ],
          "additionalProperties": false,
          "properties": {
            "reader": {
              "type": "string",
              "pattern": "^[a-z0-9][a-z0-9-]*$"
            },
            "model": {
              "type": "string",
              "minLength": 1
            },
            "version": {
              "type": "string",
              "minLength": 1
            }
          }
        }
      }
    },
    "nodes": {
      "type": "array",
      "description": "Sorted by name.",
      "items": {
        "type": "object",
        "required": [
          "name",
          "platform",
          "psp",
          "image",
          "management_port",
          "artifact",
          "bootstrap"
        ],
        "additionalProperties": false,
        "properties": {
          "name": {
            "type": "string"
          },
          "platform": {
            "type": "string",
            "description": "platform.nos"
          },
          "psp": {
            "type": "object",
            "required": [
              "id",
              "source"
            ],
            "additionalProperties": false,
            "properties": {
              "id": {
                "type": "string"
              },
              "source": {
                "enum": [
                  "embedded",
                  "override"
                ]
              }
            }
          },
          "image": {
            "type": "string"
          },
          "management_port": {
            "type": "string",
            "description": "Always the PSP's interfaces.management name: containerlab gives every node one, whether or not intent flags a mgmt_only interface."
          },
          "artifact": {
            "type": "object",
            "description": "The node’s configuration artifact, as the bundle carries it: `file` is its path in the bundle, configs/<node>.<artifact_name>, bytes exactly as Infrahub served them; `checksum` is Infrahub’s own (MD5 hex), verbatim; `size` is the byte count.",
            "required": [
              "name",
              "content_type",
              "checksum",
              "size",
              "file"
            ],
            "additionalProperties": false,
            "properties": {
              "name": {
                "type": "string",
                "minLength": 1
              },
              "content_type": {
                "type": "string",
                "pattern": "^text/"
              },
              "checksum": {
                "type": "string",
                "pattern": "^[0-9a-f]{32}$"
              },
              "size": {
                "type": "integer",
                "minimum": 0
              },
              "file": {
                "type": "string",
                "pattern": "^configs/[^/]+$"
              }
            }
          },
          "bootstrap": {
            "type": "object",
            "description": "M7: the node’s bootstrap file, rendered from its package’s template (Constitution IV), and how it reaches the node (the package’s config.bootstrap_via).",
            "required": [
              "file",
              "via"
            ],
            "additionalProperties": false,
            "properties": {
              "file": {
                "type": "string",
                "pattern": "^configs/[^/]+$"
              },
              "via": {
                "enum": [
                  "startup_config",
                  "push"
                ]
              }
            }
          }
        }
      }
    },
    "mapping": {
      "type": "array",
      "description": "One row per interface in intent. Sorted by (device, interface). M7: `node_name` on every row. M12: `enabled` on every row. 017: no `iftype`; every interface is a port.",
      "items": {
        "type": "object",
        "required": [
          "device",
          "interface",
          "mgmt_only",
          "port",
          "disposition",
          "node_name",
          "enabled"
        ],
        "additionalProperties": false,
        "properties": {
          "device": {
            "type": "string"
          },
          "interface": {
            "type": "string"
          },
          "mgmt_only": {
            "type": "boolean"
          },
          "port": {
            "type": [
              "string",
              "null"
            ],
            "description": "Node port; null when omitted or configured-not-cabled without a port"
          },
          "node_name": {
            "type": [
              "string",
              "null"
            ],
            "description": "M7: on every row. The node’s own name for the port, as the profile’s rule renders it, equal to `interface` where the platform keeps the production name; null on a row without a port."
          },
          "disposition": {
            "enum": [
              "cabled",
              "management",
              "configured-not-cabled",
              "omitted"
            ]
          },
          "enabled": {
            "type": "boolean",
            "description": "M12: the interface's intent admin state (ctm.Interface.enabled, true when unset). On every row from bundle 4. A cabled row with false is still cabled and its bootstrap still enables the port; intent's disabling reaches the node through the artifact (M5), and twin verify asserts nothing of the port or its link."
          }
        }
      }
    },
    "links": {
      "type": "array",
      "description": "Cabled links only. Sorted by id.",
      "items": {
        "type": "object",
        "required": [
          "id",
          "a",
          "b"
        ],
        "additionalProperties": false,
        "properties": {
          "id": {
            "type": "string"
          },
          "a": {
            "$ref": "#/$defs/nodePort"
          },
          "b": {
            "$ref": "#/$defs/nodePort"
          }
        }
      }
    },
    "omissions": {
      "type": "array",
      "description": "Everything left out and why. Sorted by object then rule. Never empty when the mapping has an 'omitted' row. M6: omit.interface.shared is an uncabled interface whose port a cabled interface of the same device holds; omit.interface.unmappable’s reason now names the rule, placeholder, value and range when a rule matched out of range.",
      "items": {
        "type": "object",
        "required": [
          "rule",
          "object",
          "reason"
        ],
        "additionalProperties": false,
        "properties": {
          "rule": {
            "enum": [
              "omit.link.mgmt_only",
              "omit.interface.unmappable",
              "omit.mgmt.extra",
              "omit.interface.shared"
            ]
          },
          "object": {
            "type": "string"
          },
          "reason": {
            "type": "string"
          }
        }
      }
    },
    "fidelity": {
      "type": "object",
      "description": "Asserted, never measured (D-022); `basis` says so in the bundle itself (Constitution X). M7: `production_forwarding` per platform; `lossy` always present. 017: `read`, the reader’s fidelity list.",
      "required": [
        "basis",
        "production_forwarding",
        "approximations",
        "omitted",
        "lossy",
        "read"
      ],
      "additionalProperties": false,
      "properties": {
        "basis": {
          "const": "asserted",
          "description": "Fidelity is asserted from PSP data and compiler decisions, never measured against production. The only value at M1; a verification layer would add another."
        },
        "production_forwarding": {
          "type": "object",
          "minProperties": 1,
          "propertyNames": {
            "pattern": "^[a-z0-9_]+$"
          },
          "additionalProperties": {
            "enum": [
              "hardware",
              "software"
            ]
          },
          "description": "M7 (D-025): one entry per platform in the bundle, keyed by nodes[].psp.id, holding that package’s fidelity.production_forwarding. Keys sorted. Where production forwards in software the twin’s data plane is a fair guide; where in hardware it is not (architecture §1)."
        },
        "approximations": {
          "type": "array",
          "items": {
            "type": "string"
          }
        },
        "omitted": {
          "type": "array",
          "items": {
            "type": "string"
          },
          "description": "Object identifiers, mirrors omissions[].object"
        },
        "lossy": {
          "type": "array",
          "description": "M6, unconditional from M7: one entry per interface a lossy rule mapped, and per interface whose port another interface of the same device also renders to, whichever rule; [] when there is none. Sorted by (device, interface). `port` is the rendered port even for an interface the mapping table shows omitted for sharing; `shares` lists every other interface of the device rendering to the port, sorted by interface, with its rule and whether it is cabled. Asserted, like the rest of the block.",
          "items": {
            "type": "object",
            "required": [
              "device",
              "interface",
              "port",
              "node_name",
              "rule",
              "lossy",
              "shares"
            ],
            "additionalProperties": false,
            "properties": {
              "device": {
                "type": "string"
              },
              "interface": {
                "type": "string"
              },
              "port": {
                "type": "string"
              },
              "node_name": {
                "type": "string",
                "description": "the node’s own name for the port, whether or not it differs from the production name"
              },
              "rule": {
                "type": "string",
                "description": "the rule’s name, never its position or pattern"
              },
              "lossy": {
                "type": "boolean",
                "description": "whether that rule is declared lossy; false only for an interface recorded because its port is shared"
              },
              "shares": {
                "type": "array",
                "items": {
                  "type": "object",
                  "required": [
                    "interface",
                    "rule",
                    "cabled"
                  ],
                  "additionalProperties": false,
                  "properties": {
                    "interface": {
                      "type": "string"
                    },
                    "rule": {
                      "type": "string"
                    },
                    "cabled": {
                      "type": "boolean"
                    }
                  }
                }
              }
            }
          }
        },
        "read": {
          "type": "array",
          "description": "017 (Constitution X; FR-029): the CTM envelope’s fidelity list, copied unchanged: one row per field the reader approximated and per source object it omitted, sorted by (disposition, object). Beside the packages’ `approximations` and the compiler’s `omitted` and `lossy`; [] only for a reader that wrote none.",
          "items": {
            "type": "object",
            "required": [
              "disposition",
              "object",
              "source",
              "reason"
            ],
            "additionalProperties": false,
            "properties": {
              "disposition": {
                "enum": [
                  "approximated",
                  "omitted"
                ]
              },
              "object": {
                "type": "string",
                "minLength": 1,
                "description": "The CTM field approximated (`interface.mgmt_only`, `interface.enabled`, `platform.version`) or the source object omitted (a cable, by its label or its id)."
              },
              "source": {
                "type": "string",
                "minLength": 1,
                "description": "The source field or kind the row was read from: `InterfacePhysical.role`, `InterfacePhysical.status`, `DcimPlatform`, `DcimCable`."
              },
              "reason": {
                "type": "string",
                "minLength": 1
              }
            }
          }
        }
      }
    }
  },
  "$defs": {
    "nodePort": {
      "type": "object",
      "required": [
        "node",
        "port"
      ],
      "additionalProperties": false,
      "properties": {
        "node": {
          "type": "string"
        },
        "port": {
          "type": "string"
        }
      }
    }
  }
}
