{
  "bundle_version": "5",
  "provenance": {
    "branch": "fylgja-fixture",
    "at": "2026-09-08T12:00:00Z",
    "schema_hash": "fixture",
    "scope": "tag:fylgja",
    "mapping": {
      "reader": "infrahub-dcim",
      "model": "opsmill/schema-library",
      "version": "26336e9"
    }
  },
  "nodes": [
    {
      "name": "n1",
      "platform": "srlinux",
      "psp": {
        "id": "nokia_srlinux",
        "source": "embedded"
      },
      "image": "ghcr.io/nokia/srlinux:24.7.1",
      "management_port": "mgmt0",
      "artifact": {
        "name": "device-config",
        "content_type": "text/plain",
        "checksum": "28881d3d0d61d3fe5acf1f1ee0e31a60",
        "size": 1327,
        "file": "configs/n1.device-config"
      },
      "bootstrap": {
        "file": "configs/n1.cli",
        "via": "startup_config"
      }
    },
    {
      "name": "n2",
      "platform": "srlinux",
      "psp": {
        "id": "nokia_srlinux",
        "source": "embedded"
      },
      "image": "ghcr.io/nokia/srlinux:24.7.1",
      "management_port": "mgmt0",
      "artifact": {
        "name": "device-config",
        "content_type": "text/plain",
        "checksum": "092ca9f62fe2887add0ae679de0a7076",
        "size": 1327,
        "file": "configs/n2.device-config"
      },
      "bootstrap": {
        "file": "configs/n2.cli",
        "via": "startup_config"
      }
    },
    {
      "name": "n3",
      "platform": "srlinux",
      "psp": {
        "id": "nokia_srlinux",
        "source": "embedded"
      },
      "image": "ghcr.io/nokia/srlinux:24.7.1",
      "management_port": "mgmt0",
      "artifact": {
        "name": "device-config",
        "content_type": "text/plain",
        "checksum": "95a3a91788e63626cdb9b4ecdf56eb58",
        "size": 1327,
        "file": "configs/n3.device-config"
      },
      "bootstrap": {
        "file": "configs/n3.cli",
        "via": "startup_config"
      }
    }
  ],
  "mapping": [
    {
      "device": "n1",
      "interface": "ethernet-1/1",
      "mgmt_only": false,
      "enabled": true,
      "port": "e1-1",
      "node_name": "ethernet-1/1",
      "disposition": "cabled"
    },
    {
      "device": "n1",
      "interface": "ethernet-1/10",
      "mgmt_only": false,
      "enabled": true,
      "port": "e1-10",
      "node_name": "ethernet-1/10",
      "disposition": "configured-not-cabled"
    },
    {
      "device": "n1",
      "interface": "ethernet-1/11",
      "mgmt_only": false,
      "enabled": true,
      "port": "e1-11",
      "node_name": "ethernet-1/11",
      "disposition": "configured-not-cabled"
    },
    {
      "device": "n1",
      "interface": "ethernet-1/2",
      "mgmt_only": false,
      "enabled": true,
      "port": "e1-2",
      "node_name": "ethernet-1/2",
      "disposition": "cabled"
    },
    {
      "device": "n1",
      "interface": "mgmt0",
      "mgmt_only": true,
      "enabled": true,
      "port": "mgmt0",
      "node_name": "mgmt0",
      "disposition": "management"
    },
    {
      "device": "n2",
      "interface": "ethernet-1/1",
      "mgmt_only": false,
      "enabled": true,
      "port": "e1-1",
      "node_name": "ethernet-1/1",
      "disposition": "cabled"
    },
    {
      "device": "n2",
      "interface": "ethernet-1/10",
      "mgmt_only": false,
      "enabled": true,
      "port": "e1-10",
      "node_name": "ethernet-1/10",
      "disposition": "configured-not-cabled"
    },
    {
      "device": "n2",
      "interface": "ethernet-1/11",
      "mgmt_only": false,
      "enabled": true,
      "port": "e1-11",
      "node_name": "ethernet-1/11",
      "disposition": "configured-not-cabled"
    },
    {
      "device": "n2",
      "interface": "ethernet-1/2",
      "mgmt_only": false,
      "enabled": true,
      "port": "e1-2",
      "node_name": "ethernet-1/2",
      "disposition": "cabled"
    },
    {
      "device": "n2",
      "interface": "mgmt0",
      "mgmt_only": true,
      "enabled": true,
      "port": "mgmt0",
      "node_name": "mgmt0",
      "disposition": "management"
    },
    {
      "device": "n3",
      "interface": "ethernet-1/1",
      "mgmt_only": false,
      "enabled": true,
      "port": "e1-1",
      "node_name": "ethernet-1/1",
      "disposition": "cabled"
    },
    {
      "device": "n3",
      "interface": "ethernet-1/10",
      "mgmt_only": false,
      "enabled": true,
      "port": "e1-10",
      "node_name": "ethernet-1/10",
      "disposition": "configured-not-cabled"
    },
    {
      "device": "n3",
      "interface": "ethernet-1/11",
      "mgmt_only": false,
      "enabled": true,
      "port": "e1-11",
      "node_name": "ethernet-1/11",
      "disposition": "configured-not-cabled"
    },
    {
      "device": "n3",
      "interface": "ethernet-1/2",
      "mgmt_only": false,
      "enabled": true,
      "port": "e1-2",
      "node_name": "ethernet-1/2",
      "disposition": "cabled"
    },
    {
      "device": "n3",
      "interface": "mgmt0",
      "mgmt_only": true,
      "enabled": true,
      "port": "mgmt0",
      "node_name": "mgmt0",
      "disposition": "management"
    }
  ],
  "links": [
    {
      "id": "n1:ethernet-1/1|n2:ethernet-1/1",
      "a": {
        "node": "n1",
        "port": "e1-1"
      },
      "b": {
        "node": "n2",
        "port": "e1-1"
      }
    },
    {
      "id": "n1:ethernet-1/2|n3:ethernet-1/2",
      "a": {
        "node": "n1",
        "port": "e1-2"
      },
      "b": {
        "node": "n3",
        "port": "e1-2"
      }
    },
    {
      "id": "n2:ethernet-1/2|n3:ethernet-1/1",
      "a": {
        "node": "n2",
        "port": "e1-2"
      },
      "b": {
        "node": "n3",
        "port": "e1-1"
      }
    }
  ],
  "omissions": [],
  "fidelity": {
    "basis": "asserted",
    "production_forwarding": {
      "nokia_srlinux": "hardware"
    },
    "approximations": [
      "nokia_srlinux: No linecard model; port count fixed at container start",
      "nokia_srlinux: No hardware QoS, TCAM or buffer behaviour",
      "nokia_srlinux: Convergence timing differs from hardware"
    ],
    "omitted": [],
    "lossy": [],
    "read": [
      {
        "disposition": "approximated",
        "object": "interface.enabled",
        "source": "InterfacePhysical.status",
        "reason": "a port is enabled unless its status is disabled; the library's status is not an admin state"
      },
      {
        "disposition": "approximated",
        "object": "interface.mgmt_only",
        "source": "InterfacePhysical.role",
        "reason": "the management port is the port whose role is management; the library has no management-only flag"
      },
      {
        "disposition": "omitted",
        "object": "platform.version",
        "source": "DcimPlatform",
        "reason": "the library's platform carries no version"
      }
    ]
  }
}
